{
  "schema_version": 1,
  "program_id": "lectrice-alignment-recovery",
  "accepted_main_sha": "ce3dd8a90142b8df0fc1cd67c1ad85f183c35ef0",
  "receipt_commit_parent": "ce3dd8a90142b8df0fc1cd67c1ad85f183c35ef0",
  "receipt_envelope": [
    "docs/alignment-recovery-receipt.json"
  ],
  "spec_artifacts": [
    {
      "path": "specs/079-fleet-alignment-recovery/spec.md",
      "sha256": "c0f18deafbf69b9f676a3deee4ec17dad8dc651c364b5d0be3d25ce3da6d7801"
    },
    {
      "path": "specs/079-fleet-alignment-recovery/plan.md",
      "sha256": "283bd108f7be5a457c5b24125f6a272395bd20a9477a998d39cb3510ba8652e3"
    },
    {
      "path": "specs/079-fleet-alignment-recovery/tasks.md",
      "sha256": "29488ba6f1ad4fbf488b12e8f6c2c00eab6137c38d631e75c329b92485e7542d"
    }
  ],
  "dispositions": [
    {
      "item_id": "PR #147",
      "observed_sha": "511f70dce5010b51ff8a7fff7a7f133f89f751c9",
      "category": "worthwhile-post-release-polish",
      "immutable_evidence": [
        "https://github.com/phsb5321/Tauri-PDF-Reader/pull/147",
        "refs/heads/preserve/20260820-147-reviewed-head",
        "git:6b3fa9eaeb68ccc24b99d520df4a16d6dd02828c"
      ],
      "owner": "Product/QA",
      "next_action": "No revert; retain PR #156 contrast-oracle repair",
      "falsifier": "The active-value, enabled-submit, or modern-color false-green reproduces on accepted main",
      "preservation_state": "merged-content-preserved",
      "terminal_state": "merged"
    },
    {
      "item_id": "PR #152",
      "observed_sha": "fe4725a9e6b09992f4e62c97579782b2ceb2b9c6",
      "category": "worthwhile-post-release-polish",
      "immutable_evidence": [
        "https://github.com/phsb5321/Tauri-PDF-Reader/pull/152",
        "git:A:docs/evidence/card-fold-fe4725a9.txt",
        "refs/heads/origin/151-card-fold"
      ],
      "owner": "Product/QA",
      "next_action": "Re-specify card-fold geometry after recovery",
      "falsifier": "The accepted-main north-star journey fails because card geometry makes Open or Resume unusable",
      "preservation_state": "remote-preserved",
      "terminal_state": "closed-with-reason"
    },
    {
      "item_id": "complete-ref-ledger",
      "observed_sha": "ce3dd8a90142b8df0fc1cd67c1ad85f183c35ef0",
      "category": "duplicate",
      "immutable_evidence": [
        "git:A:docs/alignment-recovery-branch-ledger.md",
        "sha256:ce7f72d640f19df9d54a66fa2ac1549c75d4a566848a72a7f21c6d00d42566fd"
      ],
      "owner": "Graph",
      "next_action": "Use the ledger as the complete point-in-time disposition reference",
      "falsifier": "A local or remote ref from the 19:36 snapshot is absent or any recorded SHA differs",
      "preservation_state": "merged-content-preserved",
      "terminal_state": "merged"
    }
  ],
  "journey": {
    "source_sha": "ce3dd8a90142b8df0fc1cd67c1ad85f183c35ef0",
    "platform_scope": "Linux/X11/WebKitGTK packaged debug binary",
    "profile_id": "lectrice-north-star-profile.Wzp8ED",
    "fixture_id": "e2e-resume-fixture-a:e9ad038b6046c47ef8cbfce52ebb71542b7137b69a4359977b6f91c90df59bb7",
    "started_at": "2026-08-20T22:11:30-03:00",
    "finished_at": "2026-08-20T22:16:58-03:00",
    "steps": [
      {
        "name": "fresh_profile",
        "actor_action": "Launch the packaged app with a new profile",
        "oracle_observation": "Library has zero document cards and exposes the Open a PDF control",
        "elapsed_ms": 63,
        "failure_reason": null,
        "result": "pass"
      },
      {
        "name": "open_pdf",
        "actor_action": "Activate the empty-state Open a PDF control and choose the deterministic picker fixture",
        "oracle_observation": "Rendered PDF text layer and document title e2e-resume-fixture-a",
        "elapsed_ms": 1329,
        "failure_reason": null,
        "result": "pass"
      },
      {
        "name": "no_key_setup_visible",
        "actor_action": "Activate Configure from the no-key playback message",
        "oracle_observation": "Connect ElevenLabs form, API-key field, provider link, and egress disclosure are visible",
        "elapsed_ms": 540,
        "failure_reason": null,
        "result": "pass"
      },
      {
        "name": "start_narration",
        "actor_action": "Activate Play after deterministic supported setup",
        "oracle_observation": "Native fixture playback is playing with word timings and an advanced word index",
        "elapsed_ms": 1038,
        "failure_reason": null,
        "result": "pass"
      },
      {
        "name": "mutate_acknowledged_state",
        "actor_action": "Create a Yellow highlight through the public selection toolbar and navigate to page 3",
        "oracle_observation": "Reader acknowledges page 3 and Highlight: alpha lectrice fixture page two the catch-up resu",
        "elapsed_ms": 1529,
        "failure_reason": null,
        "result": "pass"
      },
      {
        "name": "normal_close_process_ended",
        "actor_action": "Close the window through WM_DELETE_WINDOW",
        "oracle_observation": "Window closed in 224ms and original process ended in 214ms",
        "elapsed_ms": 434,
        "failure_reason": null,
        "result": "pass"
      },
      {
        "name": "relaunch_new_process",
        "actor_action": "Launch a new packaged application process on the same hermetic profile",
        "oracle_observation": "Fresh WebDriver session reached a new native bootstrap on the existing profile",
        "elapsed_ms": 113,
        "failure_reason": null,
        "result": "pass"
      },
      {
        "name": "resume_same_document_page",
        "actor_action": "Activate the public Resume control for page 3",
        "oracle_observation": "Reader reopened e2e-resume-fixture-a at page 3",
        "elapsed_ms": 899,
        "failure_reason": null,
        "result": "pass"
      },
      {
        "name": "highlight_present",
        "actor_action": "Return through Previous to the highlight page without creating another mark",
        "oracle_observation": "Persisted highlight containing lectrice fixture page two is rendered on page 2",
        "elapsed_ms": 535,
        "failure_reason": null,
        "result": "pass"
      }
    ],
    "artifacts": [
      {
        "id": "north-star-phase-evidence",
        "uri": "artifact://north-star/ce3dd8a90142b8df0fc1cd67c1ad85f183c35ef0/phase-evidence.json",
        "sha256": "6d074c718446d0d7e57e9dacd9ffd29184c9180fb55da51d6e0630f43b6a457d"
      }
    ],
    "result": "pass"
  },
  "checks": [
    {
      "name": "exact-main CI",
      "run_id": 32435252582,
      "subject": "accepted-main",
      "head_sha": "ce3dd8a90142b8df0fc1cd67c1ad85f183c35ef0",
      "conclusion": "success",
      "evidence_ref": "https://github.com/phsb5321/Tauri-PDF-Reader/actions/runs/32435252582"
    },
    {
      "name": "exact-main CodeQL",
      "run_id": 32435252580,
      "subject": "accepted-main",
      "head_sha": "ce3dd8a90142b8df0fc1cd67c1ad85f183c35ef0",
      "conclusion": "success",
      "evidence_ref": "https://github.com/phsb5321/Tauri-PDF-Reader/actions/runs/32435252580"
    },
    {
      "name": "exact-main SonarQube",
      "run_id": 32435252621,
      "subject": "accepted-main",
      "head_sha": "ce3dd8a90142b8df0fc1cd67c1ad85f183c35ef0",
      "conclusion": "success",
      "evidence_ref": "https://github.com/phsb5321/Tauri-PDF-Reader/actions/runs/32435252621"
    }
  ],
  "reviews": [
    {
      "reviewer": "DeepSeek V4-Pro final accepted-main gate",
      "generator_family": "openai",
      "provider_family": "chinese-frontier",
      "subject": "accepted-main",
      "head_sha": "ce3dd8a90142b8df0fc1cd67c1ad85f183c35ef0",
      "verdict": "ALLOW",
      "evidence_ref": "https://github.com/phsb5321/Tauri-PDF-Reader/pull/163#issuecomment-5364223800"
    }
  ],
  "state_refs": [
    {
      "id": "repo-backlog",
      "kind": "repository",
      "repository": "lectrice",
      "path": "docs/agent-backlog-state.md",
      "revision": "ce3dd8a90142b8df0fc1cd67c1ad85f183c35ef0",
      "sha256": "fcc4e013dbbabbeb74955cce532b499dfaa7d6447ed323ac4edb06c986251615",
      "observed_main_sha": "ce3dd8a90142b8df0fc1cd67c1ad85f183c35ef0",
      "observed_at": "2026-08-20T22:52:48-03:00"
    },
    {
      "id": "repo-branch-ledger",
      "kind": "repository",
      "repository": "lectrice",
      "path": "docs/alignment-recovery-branch-ledger.md",
      "revision": "ce3dd8a90142b8df0fc1cd67c1ad85f183c35ef0",
      "sha256": "ce7f72d640f19df9d54a66fa2ac1549c75d4a566848a72a7f21c6d00d42566fd",
      "observed_main_sha": "ce3dd8a90142b8df0fc1cd67c1ad85f183c35ef0",
      "observed_at": "2026-08-20T22:52:48-03:00"
    },
    {
      "id": "vault-save-state",
      "kind": "vault",
      "repository": "vault",
      "path": "1. Projects/Lectrice — Tauri PDF Reader/SAVE-STATE.md",
      "revision": "2bf30bbce84f37c19f16bc73f7a054884fd7da0b",
      "sha256": "31553194d7b0e2f525009d51e15529ba16c52af682bf9a03b7e15009898622fe",
      "observed_main_sha": "ce3dd8a90142b8df0fc1cd67c1ad85f183c35ef0",
      "observed_at": "2026-08-20T22:52:48-03:00"
    }
  ],
  "generated_at": "2026-08-20T22:52:48-03:00"
}
